{
  "success": true,
  "data": {
    "findings": [
      {
        "kind": "diagnostic",
        "severity": "warn",
        "message": "Example diagnostic message",
        "file": "script.ps1",
        "range": {
          "startLine": 1,
          "startCol": 1,
          "endLine": 1,
          "endCol": 10
        },
        "ruleId": "PSUseDeclaredVarsMoreThanAssignments",
        "confidence": 0.8
      }
    ],
    "patches": [
      {
        "path": "script.ps1",
        "patch": "*** unified diff here ***"
      }
    ],
    "metrics": {
      "filesAnalyzed": 12,
      "diagnostics": 3,
      "lintIssues": 4,
      "patchesGenerated": 2,
      "filesModified": 1
    }
  },
  "metadata": {
    "tool_version": "0.1.0",
    "execution_time_ms": 1234
  },
  "logs": [
    "Loaded 12 files"
  ]
}
